{
  "key": "kolto-infusion",
  "name": "Kolto Infusion",
  "powerType": "tech",
  "level": 6,
  "forceAlignment": "none",
  "castingTime": {
    "period": "action",
    "text": "1 action"
  },
  "range": "60 feet",
  "duration": "Instantaneous",
  "concentration": false,
  "description": "Choose a creature that you can see within range. A surge of kolto energy washes over the creature, causing it to regain 70 hit points. This power also ends blindness, deafness, and any diseases affecting the target. This power has no effect on droids or constructs.\n\n***Overcharge Tech.*** When you cast this power using a tech slot of 7th level or higher, the amount of healing increases by 10 for each slot level above 6th.",
  "sourceKey": "phb",
  "contentSet": "core"
}
