{
  "key": "paralyze-humanoid",
  "name": "Paralyze Humanoid",
  "powerType": "tech",
  "level": 2,
  "forceAlignment": "none",
  "castingTime": {
    "period": "action",
    "text": "1 action"
  },
  "range": "60 feet",
  "duration": "up to 1 minute",
  "concentration": true,
  "description": "You emit a paralyzing dart at a humanoid that you can see within range. The target must succeed on a Constitution saving throw or be poisoned for the duration. While poisoned in this way, the target is paralyzed. At the end of each of its turns, the target can make another Constitution saving throw. On a success, the power ends on the target.\n\n***Overcharge Tech.*** When you cast this power using a tech slot of 3rd level or higher, you can target one additional humanoid for each slot level above 2nd. The humanoids must be within 30 feet of each other when you target them.",
  "sourceKey": "phb",
  "contentSet": "core"
}
