{
  "key": "mass-malacia",
  "name": "Mass Malacia",
  "powerType": "force",
  "level": 3,
  "forceAlignment": "universal",
  "castingTime": {
    "period": "action",
    "text": "1 action"
  },
  "range": "120 feet (30-foot cube)",
  "duration": "up to 1 minute",
  "concentration": true,
  "prerequisite": "Malacia",
  "description": "Each creature in a 30-foot cube within range must make a Wisdom saving throw. On a failed save, the creature becomes charmed for the duration. While charmed by this power, the creature is incapacitated and has a speed of 0.\n\nThe power ends for an affected creature if it takes any damage or if someone else uses an action to shake the creature out of its stupor. This power has no effect on droids or constructs.",
  "sourceKey": "phb",
  "contentSet": "core"
}
